{
  "namespace": "payments",
  "clauses": [
    {
      "id": 1,
      "text": "Deny new east-west communication from the payments namespace while preserving known service dependencies.",
      "control": "egress_profile"
    },
    {
      "id": 2,
      "text": "Prevent privilege escalation by workloads in that namespace.",
      "control": "not_implementable",
      "note": "ESCALATED to a human: the model was not confident enough (best guess egress_profile, 0.58)."
    },
    {
      "id": 3,
      "text": "Restrict the compromised workload's access to the Kubernetes API.",
      "control": "restrict_api_access",
      "note": "Needs RBAC changes; admission alone cannot do it."
    },
    {
      "id": 4,
      "text": "Do not disrupt running workloads; roll out in stages and time-box any exception.",
      "control": "not_implementable",
      "note": "ESCALATED to a human: the model was not confident enough (best guess process, 0.39)."
    }
  ],
  "controls": {
    "egress_profile": {
      "enabled": true,
      "approved_profiles": [
        "db",
        "monitoring",
        "none",
        "storage"
      ],
      "in_intent": true
    },
    "restrict_api_access": {
      "enabled": false,
      "in_intent": true,
      "note": "Requires RBAC and ServiceAccount changes beyond admission control."
    }
  },
  "exceptions": [],
  "rollout": [
    "Audit",
    "Warn",
    "Deny"
  ]
}
