{
  "namespace": "payments",
  "clauses": [
    {
      "id": 1,
      "text": "Deny new east-west communication from the payments namespace while preserving known service dependencies",
      "control": "egress_profile"
    },
    {
      "id": 2,
      "text": "Prevent privilege escalation by workloads in that namespace",
      "control": "deny_privilege_escalation"
    },
    {
      "id": 3,
      "text": "Restrict the compromised workload's access to the Kubernetes API",
      "control": "restrict_api_access",
      "note": "Needs automountServiceAccountToken=false plus RBAC changes; RBAC is out of scope for an admission policy. Not generated."
    },
    {
      "id": 4,
      "text": "Do not disrupt running workloads; roll out in stages and time-box any exception",
      "control": "not_implementable",
      "note": "Process constraint. Expressed as the rollout plan and exception TTLs, not as a policy."
    }
  ],
  "controls": {
    "egress_profile": {
      "enabled": true,
      "approved_profiles": [
        "db",
        "monitoring",
        "none"
      ],
      "in_intent": true
    },
    "deny_privilege_escalation": {
      "enabled": true,
      "in_intent": true
    },
    "restrict_registry": {
      "enabled": true,
      "registry": "registry.trustfall.internal",
      "in_intent": false
    },
    "restrict_api_access": {
      "enabled": false,
      "in_intent": true,
      "note": "Requires RBAC and ServiceAccount changes beyond admission control."
    }
  },
  "exceptions": [
    {
      "workload": "backup-job",
      "control": "egress_profile",
      "owner": "platform-ops@trustfall.example",
      "ttl_hours": 24,
      "reason": "Nightly backup needs egress to the storage namespace until the backup target is moved behind the db profile."
    }
  ],
  "rollout": [
    "Audit",
    "Warn",
    "Deny"
  ]
}
